ocd-division/country:us/state:ia/county:linn/school_district:alburnett_comm_school_district,alburnett comm school district
ocd-division/country:us/state:ia/county:linn/school_district:cedar_rapids_comm_school_district,cedar rapids comm school district
ocd-division/country:us/state:ia/county:linn/school_district:center_point-urbana_comm_school_district,center point-urbana comm school district
ocd-division/country:us/state:ia/county:linn/school_district:central_city_comm_school_district,central city comm school district
ocd-division/country:us/state:ia/county:linn/school_district:college_comm_school_district,college comm school district
ocd-division/country:us/state:ia/county:linn/school_district:linn-mar_comm_school_district,linn-mar comm school district
ocd-division/country:us/state:ia/county:linn/school_district:lisbon_comm_school_district,lisbon comm school district
ocd-division/country:us/state:ia/county:linn/school_district:marion_independent_school_district,marion independent school district
ocd-division/country:us/state:ia/county:linn/school_district:mount_vernon_comm_school_district,mount vernon comm school district
ocd-division/country:us/state:ia/county:linn/school_district:north_linn_comm_school_district,north linn comm school district
ocd-division/country:us/state:ia/county:linn/school_district:springville_comm_school_district,springville comm school district
ocd-division/country:us/state:ia/county:louisa/school_district:columbus_comm_school_district,columbus comm school district
ocd-division/country:us/state:ia/county:louisa/school_district:louisa-muscatine_comm_school_district,louisa-muscatine comm school district
ocd-division/country:us/state:ia/county:louisa/school_district:morning_sun_comm_school_district,morning sun comm school district
ocd-division/country:us/state:ia/county:louisa/school_district:wapello_comm_school_district,wapello comm school district
ocd-division/country:us/state:ia/county:lucas/school_district:chariton_comm_school_district,chariton comm school district
ocd-division/country:us/state:ia/county:lyon/school_district:central_lyon_comm_school_district,central lyon comm school district
ocd-division/country:us/state:ia/county:lyon/school_district:george-little_rock_comm_school_district,george-little rock comm school district
ocd-division/country:us/state:ia/county:lyon/school_district:west_lyon_comm_school_district,west lyon comm school district
ocd-division/country:us/state:ia/county:madison/school_district:earlham_comm_school_district,earlham comm school district
ocd-division/country:us/state:ia/county:madison/school_district:interstate_35_comm_school_district,interstate 35 comm school district
ocd-division/country:us/state:ia/county:madison/school_district:winterset_comm_school_district,winterset comm school district
ocd-division/country:us/state:ia/county:mahaska/school_district:eddyville-blakesburg_comm_school_district,eddyville-blakesburg comm school district
ocd-division/country:us/state:ia/county:mahaska/school_district:fremont_comm_school_district,fremont comm school district
ocd-division/country:us/state:ia/county:mahaska/school_district:north_mahaska_comm_school_district,north mahaska comm school district
ocd-division/country:us/state:ia/county:mahaska/school_district:oskaloosa_comm_school_district,oskaloosa comm school district
ocd-division/country:us/state:ia/county:marion/school_district:knoxville_comm_school_district,knoxville comm school district
ocd-division/country:us/state:ia/county:marion/school_district:melcher-dallas_comm_school_district,melcher-dallas comm school district
ocd-division/country:us/state:ia/county:marion/school_district:pella_comm_school_district,pella comm school district
ocd-division/country:us/state:ia/county:marion/school_district:pleasantville_comm_school_district,pleasantville comm school district
ocd-division/country:us/state:ia/county:marion/school_district:twin_cedars_comm_school_district,twin cedars comm school district
ocd-division/country:us/state:ia/county:marshall/school_district:east_marshall_comm_school_district,east marshall comm school district
ocd-division/country:us/state:ia/county:marshall/school_district:marshalltown_comm_school_district,marshalltown comm school district
ocd-division/country:us/state:ia/county:marshall/school_district:west_marshall_comm_school_district,west marshall comm school district
ocd-division/country:us/state:ia/county:mills/school_district:fremont-mills_comm_school_district,fremont-mills comm school district
ocd-division/country:us/state:ia/county:mills/school_district:glenwood_comm_school_district,glenwood comm school district
ocd-division/country:us/state:ia/county:mills/school_district:malvern_comm_school_district,malvern comm school district
ocd-division/country:us/state:ia/county:mills/school_district:nishna_valley_comm_school_district,nishna valley comm school district
ocd-division/country:us/state:ia/county:mitchell/school_district:osage_comm_school_district,osage comm school district
ocd-division/country:us/state:ia/county:mitchell/school_district:st_ansgar_comm_school_district,st ansgar comm school district
ocd-division/country:us/state:ia/county:monona/school_district:maple_valley_comm_school_district,maple valley comm school district
ocd-division/country:us/state:ia/county:monona/school_district:west_monona_comm_school_district,west monona comm school district
ocd-division/country:us/state:ia/county:monona/school_district:whiting_comm_school_district,whiting comm school district
ocd-division/country:us/state:ia/county:monroe/school_district:albia_comm_school_district,albia comm school district
ocd-division/country:us/state:ia/county:montgomery/school_district:red_oak_comm_school_district,red oak comm school district
ocd-division/country:us/state:ia/county:montgomery/school_district:stanton_comm_school_district,stanton comm school district
ocd-division/country:us/state:ia/county:montgomery/school_district:villisca_comm_school_district,villisca comm school district
ocd-division/country:us/state:ia/county:muscatine/school_district:muscatine_comm_school_district,muscatine comm school district
ocd-division/country:us/state:ia/county:muscatine/school_district:west_liberty_comm_school_district,west liberty comm school district
ocd-division/country:us/state:ia/county:muscatine/school_district:wilton_comm_school_district,wilton comm school district
ocd-division/country:us/state:ia/county:o~brien/school_district:hartley-melvin-sanborn_comm_school_district,hartley-melvin-sanborn comm school district
ocd-division/country:us/state:ia/county:o~brien/school_district:sheldon_comm_school_district,sheldon comm school district
ocd-division/country:us/state:ia/county:o~brien/school_district:south_o~brien_comm_school_district,south o'brien comm school district
ocd-division/country:us/state:ia/county:osceola/school_district:sibley-ocheyedan_comm_school_district,sibley-ocheyedan comm school district
ocd-division/country:us/state:ia/county:page/school_district:clarinda_comm_school_district,clarinda comm school district
ocd-division/country:us/state:ia/county:page/school_district:essex_comm_school_district,essex comm school district
ocd-division/country:us/state:ia/county:page/school_district:shenandoah_comm_school_district,shenandoah comm school district
ocd-division/country:us/state:ia/county:page/school_district:south_page_comm_school_district,south page comm school district
ocd-division/country:us/state:ia/county:palo_alto/school_district:emmetsburg_comm_school_district,emmetsburg comm school district
ocd-division/country:us/state:ia/county:palo_alto/school_district:graettinger-terril_comm_school_district,graettinger-terril comm school district
ocd-division/country:us/state:ia/county:palo_alto/school_district:ruthven-ayrshire_comm_school_district,ruthven-ayrshire comm school district
ocd-division/country:us/state:ia/county:palo_alto/school_district:west_bend-mallard_comm_school_district,west bend-mallard comm school district
ocd-division/country:us/state:ia/county:plymouth/school_district:akron_westfield_comm_school_district,akron westfield comm school district
ocd-division/country:us/state:ia/county:plymouth/school_district:hinton_comm_school_district,hinton comm school district
ocd-division/country:us/state:ia/county:plymouth/school_district:kingsley-pierson_comm_school_district,kingsley-pierson comm school district
ocd-division/country:us/state:ia/county:plymouth/school_district:le_mars_comm_school_district,le mars comm school district
ocd-division/country:us/state:ia/county:plymouth/school_district:remsen-union_comm_school_district,remsen-union comm school district
ocd-division/country:us/state:ia/county:pocahontas/school_district:laurens-marathon_comm_school_district,laurens-marathon comm school district
ocd-division/country:us/state:ia/county:pocahontas/school_district:pocahontas_area_comm_school_district,pocahontas area comm school district
ocd-division/country:us/state:ia/county:polk/school_district:ankeny_comm_school_district,ankeny comm school district
ocd-division/country:us/state:ia/county:polk/school_district:bondurant-farrar_comm_school_district,bondurant-farrar comm school district
ocd-division/country:us/state:ia/county:polk/school_district:des_moines_independent_comm_school_district,des moines independent comm school district
ocd-division/country:us/state:ia/county:polk/school_district:johnston_comm_school_district,johnston comm school district
ocd-division/country:us/state:ia/county:polk/school_district:north_polk_comm_school_district,north polk comm school district
ocd-division/country:us/state:ia/county:polk/school_district:saydel_comm_school_district,saydel comm school district
ocd-division/country:us/state:ia/county:polk/school_district:southeast_polk_comm_school_district,southeast polk comm school district
ocd-division/country:us/state:ia/county:polk/school_district:urbandale_comm_school_district,urbandale comm school district
ocd-division/country:us/state:ia/county:polk/school_district:west_des_moines_comm_school_district,west des moines comm school district
ocd-division/country:us/state:ia/county:pottawattamie/school_district:a-h-s-t_comm_school_district,a-h-s-t comm school district
ocd-division/country:us/state:ia/county:pottawattamie/school_district:council_bluffs_comm_school_district,council bluffs comm school district
ocd-division/country:us/state:ia/county:pottawattamie/school_district:lewis_central_comm_school_district,lewis central comm school district
ocd-division/country:us/state:ia/county:pottawattamie/school_district:riverside_comm_school_district,riverside comm school district
ocd-division/country:us/state:ia/county:pottawattamie/school_district:treynor_comm_school_district,treynor comm school district
ocd-division/country:us/state:ia/county:pottawattamie/school_district:tri-center_comm_school_district,tri-center comm school district
ocd-division/country:us/state:ia/county:pottawattamie/school_district:underwood_comm_school_district,underwood comm school district
ocd-division/country:us/state:ia/county:pottawattamie/school_district:walnut_comm_school_district,walnut comm school district
ocd-division/country:us/state:ia/county:poweshiek/school_district:brooklyn-guernsey-malcom_comm_school_district,brooklyn-guernsey-malcom comm school district
ocd-division/country:us/state:ia/county:poweshiek/school_district:grinnell-newburg_comm_school_district,grinnell-newburg comm school district
ocd-division/country:us/state:ia/county:poweshiek/school_district:montezuma_comm_school_district,montezuma comm school district
ocd-division/country:us/state:ia/county:ringgold/school_district:diagonal_comm_school_district,diagonal comm school district
ocd-division/country:us/state:ia/county:ringgold/school_district:mount_ayr_comm_school_district,mount ayr comm school district
ocd-division/country:us/state:ia/county:sac/school_district:odebolt-arthur_comm_school_district,odebolt-arthur comm school district
ocd-division/country:us/state:ia/county:sac/school_district:sac_comm_school_district,sac comm school district
ocd-division/country:us/state:ia/county:sac/school_district:schaller-crestland_comm_school_district,schaller-crestland comm school district
ocd-division/country:us/state:ia/county:sac/school_district:wall_lake_view_auburn_comm_school_district,wall lake view auburn comm school district
ocd-division/country:us/state:ia/county:scott/school_district:bettendorf_comm_school_district,bettendorf comm school district
ocd-division/country:us/state:ia/county:scott/school_district:davenport_comm_school_district,davenport comm school district
ocd-division/country:us/state:ia/county:scott/school_district:north_scott_comm_school_district,north scott comm school district
ocd-division/country:us/state:ia/county:scott/school_district:pleasant_valley_comm_school_district,pleasant valley comm school district
ocd-division/country:us/state:ia/county:shelby/school_district:elk_horn-kimballton_comm_school_district,elk horn-kimballton comm school district
ocd-division/country:us/state:ia/county:shelby/school_district:harlan_comm_school_district,harlan comm school district
ocd-division/country:us/state:ia/county:sioux/school_district:boyden-hull_comm_school_district,boyden-hull comm school district
ocd-division/country:us/state:ia/county:sioux/school_district:moc-floyd_valley_comm_school_district,moc-floyd valley comm school district
ocd-division/country:us/state:ia/county:sioux/school_district:rock_valley_comm_school_district,rock valley comm school district
ocd-division/country:us/state:ia/county:sioux/school_district:sioux_center_comm_school_district,sioux center comm school district
ocd-division/country:us/state:ia/county:sioux/school_district:west_sioux_comm_school_district,west sioux comm school district
ocd-division/country:us/state:ia/county:story/school_district:ames_comm_school_district,ames comm school district
ocd-division/country:us/state:ia/county:story/school_district:ballard_comm_school_district,ballard comm school district
ocd-division/country:us/state:ia/county:story/school_district:collins-maxwell_comm_school_district,collins-maxwell comm school district
ocd-division/country:us/state:ia/county:story/school_district:colo-nesco_comm_school_district,colo-nesco comm school district
ocd-division/country:us/state:ia/county:story/school_district:gilbert_comm_school_district,gilbert comm school district
ocd-division/country:us/state:ia/county:story/school_district:nevada_comm_school_district,nevada comm school district
ocd-division/country:us/state:ia/county:story/school_district:roland-story_comm_school_district,roland-story comm school district
ocd-division/country:us/state:ia/county:tama/school_district:gmg_comm_school_district,gmg comm school district
ocd-division/country:us/state:ia/county:tama/school_district:north_tama_county_comm_school_district,north tama county comm school district
ocd-division/country:us/state:ia/county:tama/school_district:south_tama_county_comm_school_district,south tama county comm school district
ocd-division/country:us/state:ia/county:taylor/school_district:bedford_comm_school_district,bedford comm school district
ocd-division/country:us/state:ia/county:taylor/school_district:clearfield_comm_school_district,clearfield comm school district
ocd-division/country:us/state:ia/county:taylor/school_district:lenox_comm_school_district,lenox comm school district
ocd-division/country:us/state:ia/county:union/school_district:creston_comm_school_district,creston comm school district
ocd-division/country:us/state:ia/county:union/school_district:east_union_comm_school_district,east union comm school district
ocd-division/country:us/state:ia/county:van_buren/school_district:harmony_comm_school_district,harmony comm school district
ocd-division/country:us/state:ia/county:van_buren/school_district:van_buren_comm_school_district,van buren comm school district
ocd-division/country:us/state:ia/county:wapello/school_district:cardinal_comm_school_district,cardinal comm school district
ocd-division/country:us/state:ia/county:wapello/school_district:ottumwa_comm_school_district,ottumwa comm school district
ocd-division/country:us/state:ia/county:warren/school_district:carlisle_comm_school_district,carlisle comm school district
ocd-division/country:us/state:ia/county:warren/school_district:indianola_comm_school_district,indianola comm school district
ocd-division/country:us/state:ia/county:warren/school_district:martensdale-st_marys_comm_school_district,martensdale-st marys comm school district
ocd-division/country:us/state:ia/county:warren/school_district:norwalk_comm_school_district,norwalk comm school district
ocd-division/country:us/state:ia/county:warren/school_district:southeast_warren_comm_school_district,southeast warren comm school district
ocd-division/country:us/state:ia/county:washington/school_district:highland_comm_school_district,highland comm school district
ocd-division/country:us/state:ia/county:washington/school_district:mid-prairie_comm_school_district,mid-prairie comm school district
ocd-division/country:us/state:ia/county:washington/school_district:washington_comm_school_district,washington comm school district
ocd-division/country:us/state:ia/county:wayne/school_district:lineville-clio_comm_school_district,lineville-clio comm school district
ocd-division/country:us/state:ia/county:wayne/school_district:mormon_trail_comm_school_district,mormon trail comm school district
ocd-division/country:us/state:ia/county:wayne/school_district:seymour_comm_school_district,seymour comm school district
ocd-division/country:us/state:ia/county:wayne/school_district:wayne_comm_school_district,wayne comm school district
ocd-division/country:us/state:ia/county:webster/school_district:fort_dodge_comm_school_district,fort dodge comm school district
ocd-division/country:us/state:ia/county:webster/school_district:prairie_valley_comm_school_district,prairie valley comm school district
ocd-division/country:us/state:ia/county:webster/school_district:southeast_webster_grand_comm_school_district,southeast webster grand comm school district
ocd-division/country:us/state:ia/county:winnebago/school_district:forest_city_comm_school_district,forest city comm school district
ocd-division/country:us/state:ia/county:winnebago/school_district:lake_mills_comm_school_district,lake mills comm school district
ocd-division/country:us/state:ia/county:winnebago/school_district:north_iowa_comm_school_district,north iowa comm school district
ocd-division/country:us/state:ia/county:winneshiek/school_district:decorah_community_school_district,decorah community school district
ocd-division/country:us/state:ia/county:winneshiek/school_district:north_winneshiek_comm_school_district,north winneshiek comm school district
ocd-division/country:us/state:ia/county:winneshiek/school_district:south_winneshiek_comm_school_district,south winneshiek comm school district
ocd-division/country:us/state:ia/county:winneshiek/school_district:turkey_valley_comm_school_district,turkey valley comm school district
ocd-division/country:us/state:ia/county:woodbury/school_district:anthon-oto_comm_school_district,anthon-oto comm school district
ocd-division/country:us/state:ia/county:woodbury/school_district:lawton-bronson_comm_school_district,lawton-bronson comm school district
ocd-division/country:us/state:ia/county:woodbury/school_district:river_valley_comm_school_district,river valley comm school district
ocd-division/country:us/state:ia/county:woodbury/school_district:sergeant_bluff-luton_comm_school_district,sergeant bluff-luton comm school district
ocd-division/country:us/state:ia/county:woodbury/school_district:sioux_city_comm_school_district,sioux city comm school district
ocd-division/country:us/state:ia/county:woodbury/school_district:westwood_comm_school_district,westwood comm school district
ocd-division/country:us/state:ia/county:woodbury/school_district:woodbury_central_comm_school_district,woodbury central comm school district
ocd-division/country:us/state:ia/county:worth/school_district:north_central_comm_school_district,north central comm school district
ocd-division/country:us/state:ia/county:worth/school_district:northwood-kensett_comm_school_district,northwood-kensett comm school district
ocd-division/country:us/state:ia/county:wright/school_district:belmond-klemme_comm_school_district,belmond-klemme comm school district
ocd-division/country:us/state:ia/county:wright/school_district:clarion-goldfield_comm_school_district,clarion-goldfield comm school district
ocd-division/country:us/state:ia/county:wright/school_district:dows_comm_school_district,dows comm school district
ocd-division/country:us/state:ia/county:wright/school_district:eagle_grove_comm_school_district,eagle grove comm school district
