ocd-division/country:us/state:ia/county:adair/school_district:nodaway_valley_comm_school_district,nodaway valley comm school district
ocd-division/country:us/state:ia/county:adair/school_district:orient-macksburg_comm_school_district,orient-macksburg comm school district
ocd-division/country:us/state:ia/county:adams/school_district:corning_comm_school_district,corning comm school district
ocd-division/country:us/state:ia/county:adams/school_district:prescott_comm_school_district,prescott comm school district
ocd-division/country:us/state:ia/county:allamakee/school_district:allamakee_comm_school_district,allamakee comm school district
ocd-division/country:us/state:ia/county:allamakee/school_district:eastern_allamakee_comm_school_district,eastern allamakee comm school district
ocd-division/country:us/state:ia/county:allamakee/school_district:postville_comm_school_district,postville comm school district
ocd-division/country:us/state:ia/county:appanoose/school_district:centerville_comm_school_district,centerville comm school district
ocd-division/country:us/state:ia/county:appanoose/school_district:moravia_comm_school_district,moravia comm school district
ocd-division/country:us/state:ia/county:appanoose/school_district:moulton-udell_comm_school_district,moulton-udell comm school district
ocd-division/country:us/state:ia/county:audubon/school_district:audubon_comm_school_district,audubon comm school district
ocd-division/country:us/state:ia/county:audubon/school_district:exira_comm_school_district,exira comm school district
ocd-division/country:us/state:ia/county:benton/school_district:belle_plaine_comm_school_district,belle plaine comm school district
ocd-division/country:us/state:ia/county:benton/school_district:benton_comm_school_district,benton comm school district
ocd-division/country:us/state:ia/county:benton/school_district:vinton-shellsburg_comm_school_district,vinton-shellsburg comm school district
ocd-division/country:us/state:ia/county:black_hawk/school_district:cedar_falls_comm_school_district,cedar falls comm school district
ocd-division/country:us/state:ia/county:black_hawk/school_district:dunkerton_comm_school_district,dunkerton comm school district
ocd-division/country:us/state:ia/county:black_hawk/school_district:hudson_comm_school_district,hudson comm school district
ocd-division/country:us/state:ia/county:black_hawk/school_district:union_comm_school_district,union comm school district
ocd-division/country:us/state:ia/county:black_hawk/school_district:waterloo_comm_school_district,waterloo comm school district
ocd-division/country:us/state:ia/county:boone/school_district:boone_comm_school_district,boone comm school district
ocd-division/country:us/state:ia/county:boone/school_district:madrid_comm_school_district,madrid comm school district
ocd-division/country:us/state:ia/county:boone/school_district:ogden_comm_school_district,ogden comm school district
ocd-division/country:us/state:ia/county:boone/school_district:united_comm_school_district,united comm school district
ocd-division/country:us/state:ia/county:bremer/school_district:denver_comm_school_district,denver comm school district
ocd-division/country:us/state:ia/county:bremer/school_district:janesville_consolidated_school_district,janesville consolidated school district
ocd-division/country:us/state:ia/county:bremer/school_district:sumner_comm_school_district,sumner comm school district
ocd-division/country:us/state:ia/county:bremer/school_district:tripoli_comm_school_district,tripoli comm school district
ocd-division/country:us/state:ia/county:bremer/school_district:wapsie_valley_comm_school_district,wapsie valley comm school district
ocd-division/country:us/state:ia/county:bremer/school_district:waverly-shell_rock_comm_school_district,waverly-shell rock comm school district
ocd-division/country:us/state:ia/county:buchanan/school_district:east_buchanan_comm_school_district,east buchanan comm school district
ocd-division/country:us/state:ia/county:buchanan/school_district:independence_comm_school_district,independence comm school district
ocd-division/country:us/state:ia/county:buchanan/school_district:jesup_comm_school_district,jesup comm school district
ocd-division/country:us/state:ia/county:buena_vista/school_district:albert_city-truesdale_comm_school_district,albert city-truesdale comm school district
ocd-division/country:us/state:ia/county:buena_vista/school_district:alta_comm_school_district,alta comm school district
ocd-division/country:us/state:ia/county:buena_vista/school_district:newell-fonda_comm_school_district,newell-fonda comm school district
ocd-division/country:us/state:ia/county:buena_vista/school_district:sioux_central_comm_school_district,sioux central comm school district
ocd-division/country:us/state:ia/county:buena_vista/school_district:storm_lake_comm_school_district,storm lake comm school district
ocd-division/country:us/state:ia/county:butler/school_district:allison-bristow_comm_school_district,allison-bristow comm school district
ocd-division/country:us/state:ia/county:butler/school_district:aplington-parkersburg_comm_school_district,aplington-parkersburg comm school district
ocd-division/country:us/state:ia/county:butler/school_district:clarksville_comm_school_district,clarksville comm school district
ocd-division/country:us/state:ia/county:butler/school_district:greene_comm_school_district,greene comm school district
ocd-division/country:us/state:ia/county:calhoun/school_district:manson_northwest_webster_comm_school_district,manson northwest webster comm school district
ocd-division/country:us/state:ia/county:calhoun/school_district:pomeroy-palmer_comm_school_district,pomeroy-palmer comm school district
ocd-division/country:us/state:ia/county:calhoun/school_district:rockwell_city-lytton_comm_school_district,rockwell city-lytton comm school district
ocd-division/country:us/state:ia/county:calhoun/school_district:southern_cal_comm_school_district,southern cal comm school district
ocd-division/country:us/state:ia/county:carroll/school_district:carroll_comm_school_district,carroll comm school district
ocd-division/country:us/state:ia/county:carroll/school_district:coon_rapids-bayard_comm_school_district,coon rapids-bayard comm school district
ocd-division/country:us/state:ia/county:carroll/school_district:glidden-ralston_comm_school_district,glidden-ralston comm school district
ocd-division/country:us/state:ia/county:carroll/school_district:manning_comm_school_district,manning comm school district
ocd-division/country:us/state:ia/county:cass/school_district:anita_comm_school_district,anita comm school district
ocd-division/country:us/state:ia/county:cass/school_district:atlantic_comm_school_district,atlantic comm school district
ocd-division/country:us/state:ia/county:cass/school_district:c_and_m_comm_school_district,c and m comm school district
ocd-division/country:us/state:ia/county:cass/school_district:griswold_comm_school_district,griswold comm school district
ocd-division/country:us/state:ia/county:cedar/school_district:bennett_comm_school_district,bennett comm school district
ocd-division/country:us/state:ia/county:cedar/school_district:durant_comm_school_district,durant comm school district
ocd-division/country:us/state:ia/county:cedar/school_district:north_cedar_comm_school_district,north cedar comm school district
ocd-division/country:us/state:ia/county:cedar/school_district:tipton_comm_school_district,tipton comm school district
ocd-division/country:us/state:ia/county:cedar/school_district:west_branch_comm_school_district,west branch comm school district
ocd-division/country:us/state:ia/county:cerro_gordo/school_district:clear_lake_comm_school_district,clear lake comm school district
ocd-division/country:us/state:ia/county:cerro_gordo/school_district:mason_city_comm_school_district,mason city comm school district
ocd-division/country:us/state:ia/county:cerro_gordo/school_district:rockwell-swaledale_comm_school_district,rockwell-swaledale comm school district
ocd-division/country:us/state:ia/county:cerro_gordo/school_district:ventura_comm_school_district,ventura comm school district
ocd-division/country:us/state:ia/county:cherokee/school_district:aurelia_comm_school_district,aurelia comm school district
ocd-division/country:us/state:ia/county:cherokee/school_district:cherokee_comm_school_district,cherokee comm school district
ocd-division/country:us/state:ia/county:cherokee/school_district:marcus-meriden-cleghorn_comm_school_district,marcus-meriden-cleghorn comm school district
ocd-division/country:us/state:ia/county:chickasaw/school_district:fredericksburg_comm_school_district,fredericksburg comm school district
ocd-division/country:us/state:ia/county:chickasaw/school_district:nashua-plainfield_comm_school_district,nashua-plainfield comm school district
ocd-division/country:us/state:ia/county:chickasaw/school_district:new_hampton_comm_school_district,new hampton comm school district
ocd-division/country:us/state:ia/county:clarke/school_district:clarke_comm_school_district,clarke comm school district
ocd-division/country:us/state:ia/county:clarke/school_district:murray_comm_school_district,murray comm school district
ocd-division/country:us/state:ia/county:clay/school_district:clay_central-everly_comm_school_district,clay central-everly comm school district
ocd-division/country:us/state:ia/county:clay/school_district:spencer_comm_school_district,spencer comm school district
ocd-division/country:us/state:ia/county:clayton/school_district:central_comm_school_district,central comm school district
ocd-division/country:us/state:ia/county:clayton/school_district:clayton_ridge_comm_school_district,clayton ridge comm school district
ocd-division/country:us/state:ia/county:clayton/school_district:mfl_marmac_comm_school_district,mfl marmac comm school district
ocd-division/country:us/state:ia/county:clinton/school_district:calamus-wheatland_comm_school_district,calamus-wheatland comm school district
ocd-division/country:us/state:ia/county:clinton/school_district:camanche_comm_school_district,camanche comm school district
ocd-division/country:us/state:ia/county:clinton/school_district:central_clinton_comm_school_district,central clinton comm school district
ocd-division/country:us/state:ia/county:clinton/school_district:clinton_comm_school_district,clinton comm school district
ocd-division/country:us/state:ia/county:clinton/school_district:delwood_comm_school_district,delwood comm school district
ocd-division/country:us/state:ia/county:clinton/school_district:northeast_comm_school_district,northeast comm school district
ocd-division/country:us/state:ia/county:crawford/school_district:ar-we-va_comm_school_district,ar-we-va comm school district
ocd-division/country:us/state:ia/county:crawford/school_district:charter_oak-ute_comm_school_district,charter oak-ute comm school district
ocd-division/country:us/state:ia/county:crawford/school_district:denison_comm_school_district,denison comm school district
ocd-division/country:us/state:ia/county:crawford/school_district:ikm_comm_school_district,ikm comm school district
ocd-division/country:us/state:ia/county:crawford/school_district:schleswig_comm_school_district,schleswig comm school district
ocd-division/country:us/state:ia/county:dallas/school_district:adel_desoto_minburn_comm_school_district,adel desoto minburn comm school district
ocd-division/country:us/state:ia/county:dallas/school_district:dallas_center-grimes_comm_school_district,dallas center-grimes comm school district
ocd-division/country:us/state:ia/county:dallas/school_district:perry_comm_school_district,perry comm school district
ocd-division/country:us/state:ia/county:dallas/school_district:van_meter_comm_school_district,van meter comm school district
ocd-division/country:us/state:ia/county:dallas/school_district:waukee_comm_school_district,waukee comm school district
ocd-division/country:us/state:ia/county:dallas/school_district:woodward-granger_comm_school_district,woodward-granger comm school district
ocd-division/country:us/state:ia/county:davis/school_district:davis_county_comm_school_district,davis county comm school district
ocd-division/country:us/state:ia/county:decatur/school_district:central_decatur_comm_school_district,central decatur comm school district
ocd-division/country:us/state:ia/county:decatur/school_district:lamoni_comm_school_district,lamoni comm school district
ocd-division/country:us/state:ia/county:delaware/school_district:edgewood-colesburg_comm_school_district,edgewood-colesburg comm school district
ocd-division/country:us/state:ia/county:delaware/school_district:maquoketa_valley_comm_school_district,maquoketa valley comm school district
ocd-division/country:us/state:ia/county:delaware/school_district:west_delaware_county_comm_school_district,west delaware county comm school district
ocd-division/country:us/state:ia/county:des_moines/school_district:burlington_comm_school_district,burlington comm school district
ocd-division/country:us/state:ia/county:des_moines/school_district:danville_comm_school_district,danville comm school district
ocd-division/country:us/state:ia/county:des_moines/school_district:mediapolis_comm_school_district,mediapolis comm school district
ocd-division/country:us/state:ia/county:des_moines/school_district:west_burlington_ind_school_district,west burlington ind school district
ocd-division/country:us/state:ia/county:dickinson/school_district:harris-lake_park_comm_school_district,harris-lake park comm school district
ocd-division/country:us/state:ia/county:dickinson/school_district:okoboji_comm_school_district,okoboji comm school district
ocd-division/country:us/state:ia/county:dickinson/school_district:spirit_lake_comm_school_district,spirit lake comm school district
ocd-division/country:us/state:ia/county:dubuque/school_district:dubuque_comm_school_district,dubuque comm school district
ocd-division/country:us/state:ia/county:dubuque/school_district:western_dubuque_comm_school_district,western dubuque comm school district
ocd-division/country:us/state:ia/county:emmet/school_district:armstrong-ringsted_comm_school_district,armstrong-ringsted comm school district
ocd-division/country:us/state:ia/county:emmet/school_district:estherville_lincoln_central_com_sch_dist,estherville lincoln central com sch dist
ocd-division/country:us/state:ia/county:fayette/school_district:north_fayette_comm_school_district,north fayette comm school district
ocd-division/country:us/state:ia/county:fayette/school_district:oelwein_comm_school_district,oelwein comm school district
ocd-division/country:us/state:ia/county:fayette/school_district:starmont_comm_school_district,starmont comm school district
ocd-division/country:us/state:ia/county:fayette/school_district:valley_comm_school_district,valley comm school district
ocd-division/country:us/state:ia/county:fayette/school_district:west_central_comm_school_district,west central comm school district
ocd-division/country:us/state:ia/county:floyd/school_district:charles_city_comm_school_district,charles city comm school district
ocd-division/country:us/state:ia/county:floyd/school_district:nora_springs-rock_falls_comm_school_district,nora springs-rock falls comm school district
ocd-division/country:us/state:ia/county:floyd/school_district:rudd-rockford-marble_rk_comm_school_district,rudd-rockford-marble rk comm school district
ocd-division/country:us/state:ia/county:franklin/school_district:cal_comm_school_district,cal comm school district
ocd-division/country:us/state:ia/county:franklin/school_district:hampton-dumont_comm_school_district,hampton-dumont comm school district
ocd-division/country:us/state:ia/county:franklin/school_district:sheffield_chapin_meservey_thornton_csd,sheffield chapin meservey thornton csd
ocd-division/country:us/state:ia/county:fremont/school_district:farragut_comm_school_district,farragut comm school district
ocd-division/country:us/state:ia/county:fremont/school_district:hamburg_comm_school_district,hamburg comm school district
ocd-division/country:us/state:ia/county:fremont/school_district:sidney_comm_school_district,sidney comm school district
ocd-division/country:us/state:ia/county:greene/school_district:east_greene_comm_school_district,east greene comm school district
ocd-division/country:us/state:ia/county:greene/school_district:jefferson-scranton_comm_school_district,jefferson-scranton comm school district
ocd-division/country:us/state:ia/county:greene/school_district:paton-churdan_comm_school_district,paton-churdan comm school district
ocd-division/country:us/state:ia/county:grundy/school_district:bcluw_comm_school_district,bcluw comm school district
ocd-division/country:us/state:ia/county:grundy/school_district:dike-new_hartford_comm_school_district,dike-new hartford comm school district
ocd-division/country:us/state:ia/county:grundy/school_district:gladbrook-reinbeck_comm_school_district,gladbrook-reinbeck comm school district
ocd-division/country:us/state:ia/county:grundy/school_district:grundy_center_comm_school_district,grundy center comm school district
ocd-division/country:us/state:ia/county:guthrie/school_district:adair-casey_comm_school_district,adair-casey comm school district
ocd-division/country:us/state:ia/county:guthrie/school_district:guthrie_center_comm_school_district,guthrie center comm school district
ocd-division/country:us/state:ia/county:guthrie/school_district:panorama_comm_school_district,panorama comm school district
ocd-division/country:us/state:ia/county:guthrie/school_district:west_central_valley_comm_school_district,west central valley comm school district
ocd-division/country:us/state:ia/county:hamilton/school_district:northeast_hamilton_comm_school_district,northeast hamilton comm school district
ocd-division/country:us/state:ia/county:hamilton/school_district:south_hamilton_comm_school_district,south hamilton comm school district
ocd-division/country:us/state:ia/county:hamilton/school_district:stratford_comm_school_district,stratford comm school district
ocd-division/country:us/state:ia/county:hamilton/school_district:webster_city_comm_school_district,webster city comm school district
ocd-division/country:us/state:ia/county:hancock/school_district:corwith-wesley_comm_school_district,corwith-wesley comm school district
ocd-division/country:us/state:ia/county:hancock/school_district:garner-hayfield_comm_school_district,garner-hayfield comm school district
ocd-division/country:us/state:ia/county:hancock/school_district:west_hancock_comm_school_district,west hancock comm school district
ocd-division/country:us/state:ia/county:hancock/school_district:woden-crystal_lake_comm_school_district,woden-crystal lake comm school district
ocd-division/country:us/state:ia/county:hardin/school_district:agwsr_comm_school_district,agwsr comm school district
ocd-division/country:us/state:ia/county:hardin/school_district:alden_comm_school_district,alden comm school district
ocd-division/country:us/state:ia/county:hardin/school_district:eldora-new_providence_comm_school_district,eldora-new providence comm school district
ocd-division/country:us/state:ia/county:hardin/school_district:hubbard-radcliffe_comm_school_district,hubbard-radcliffe comm school district
ocd-division/country:us/state:ia/county:hardin/school_district:iowa_falls_comm_school_district,iowa falls comm school district
ocd-division/country:us/state:ia/county:harrison/school_district:boyer_valley_comm_school_district,boyer valley comm school district
ocd-division/country:us/state:ia/county:harrison/school_district:logan-magnolia_comm_school_district,logan-magnolia comm school district
ocd-division/country:us/state:ia/county:harrison/school_district:missouri_valley_comm_school_district,missouri valley comm school district
ocd-division/country:us/state:ia/county:harrison/school_district:west_harrison_comm_school_district,west harrison comm school district
ocd-division/country:us/state:ia/county:harrison/school_district:woodbine_comm_school_district,woodbine comm school district
ocd-division/country:us/state:ia/county:henry/school_district:mount_pleasant_comm_school_district,mount pleasant comm school district
ocd-division/country:us/state:ia/county:henry/school_district:new_london_comm_school_district,new london comm school district
ocd-division/country:us/state:ia/county:henry/school_district:waco_comm_school_district,waco comm school district
ocd-division/country:us/state:ia/county:henry/school_district:winfield-mt_union_comm_school_district,winfield-mt union comm school district
ocd-division/country:us/state:ia/county:howard/school_district:howard-winneshiek_comm_school_district,howard-winneshiek comm school district
ocd-division/country:us/state:ia/county:howard/school_district:riceville_comm_school_district,riceville comm school district
ocd-division/country:us/state:ia/county:humboldt/school_district:gilmore_city-bradgate_comm_school_district,gilmore city-bradgate comm school district
ocd-division/country:us/state:ia/county:humboldt/school_district:humboldt_comm_school_district,humboldt comm school district
ocd-division/country:us/state:ia/county:humboldt/school_district:twin_rivers_comm_school_district,twin rivers comm school district
ocd-division/country:us/state:ia/county:ida/school_district:battle_creek-ida_grove_comm_school_district,battle creek-ida grove comm school district
ocd-division/country:us/state:ia/county:ida/school_district:galva-holstein_comm_school_district,galva-holstein comm school district
ocd-division/country:us/state:ia/county:iowa/school_district:english_valleys_comm_school_district,english valleys comm school district
ocd-division/country:us/state:ia/county:iowa/school_district:h-l-v_comm_school_district,h-l-v comm school district
ocd-division/country:us/state:ia/county:iowa/school_district:iowa_valley_comm_school_district,iowa valley comm school district
ocd-division/country:us/state:ia/county:iowa/school_district:williamsburg_comm_school_district,williamsburg comm school district
ocd-division/country:us/state:ia/county:jackson/school_district:andrew_comm_school_district,andrew comm school district
ocd-division/country:us/state:ia/county:jackson/school_district:bellevue_comm_school_district,bellevue comm school district
ocd-division/country:us/state:ia/county:jackson/school_district:east_central_comm_school_district,east central comm school district
ocd-division/country:us/state:ia/county:jackson/school_district:maquoketa_comm_school_district,maquoketa comm school district
ocd-division/country:us/state:ia/county:jackson/school_district:preston_comm_school_district,preston comm school district
ocd-division/country:us/state:ia/county:jasper/school_district:baxter_comm_school_district,baxter comm school district
ocd-division/country:us/state:ia/county:jasper/school_district:colfax-mingo_comm_school_district,colfax-mingo comm school district
ocd-division/country:us/state:ia/county:jasper/school_district:lynnville-sully_comm_school_district,lynnville-sully comm school district
ocd-division/country:us/state:ia/county:jasper/school_district:newton_comm_school_district,newton comm school district
ocd-division/country:us/state:ia/county:jasper/school_district:pcm_comm_school_district,pcm comm school district
ocd-division/country:us/state:ia/county:jefferson/school_district:fairfield_comm_school_district,fairfield comm school district
ocd-division/country:us/state:ia/county:jefferson/school_district:pekin_comm_school_district,pekin comm school district
ocd-division/country:us/state:ia/county:johnson/school_district:clear_creek_amana_comm_school_district,clear creek amana comm school district
ocd-division/country:us/state:ia/county:johnson/school_district:iowa_city_comm_school_district,iowa city comm school district
ocd-division/country:us/state:ia/county:johnson/school_district:lone_tree_comm_school_district,lone tree comm school district
ocd-division/country:us/state:ia/county:johnson/school_district:solon_comm_school_district,solon comm school district
ocd-division/country:us/state:ia/county:jones/school_district:anamosa_comm_school_district,anamosa comm school district
ocd-division/country:us/state:ia/county:jones/school_district:midland_comm_school_district,midland comm school district
ocd-division/country:us/state:ia/county:jones/school_district:monticello_comm_school_district,monticello comm school district
ocd-division/country:us/state:ia/county:jones/school_district:olin_consolidated_school_district,olin consolidated school district
ocd-division/country:us/state:ia/county:keokuk/school_district:keota_comm_school_district,keota comm school district
ocd-division/country:us/state:ia/county:keokuk/school_district:sigourney_comm_school_district,sigourney comm school district
ocd-division/country:us/state:ia/county:keokuk/school_district:tri-county_comm_school_district,tri-county comm school district
ocd-division/country:us/state:ia/county:kossuth/school_district:algona_comm_school_district,algona comm school district
ocd-division/country:us/state:ia/county:kossuth/school_district:luverne_comm_school_district,luverne comm school district
ocd-division/country:us/state:ia/county:kossuth/school_district:north_kossuth_comm_school_district,north kossuth comm school district
ocd-division/country:us/state:ia/county:kossuth/school_district:sentral_comm_school_district,sentral comm school district
ocd-division/country:us/state:ia/county:kossuth/school_district:titonka_consolidated_school_district,titonka consolidated school district
ocd-division/country:us/state:ia/county:lee/school_district:central_lee_comm_school_district,central lee comm school district
ocd-division/country:us/state:ia/county:lee/school_district:fort_madison_comm_school_district,fort madison comm school district
ocd-division/country:us/state:ia/county:lee/school_district:keokuk_comm_school_district,keokuk comm school district
